### ISSUE TITLE
LVS异常查证

### ISSUE THREAD

**Issue by yinhongliang** [yinhongliang/Blog#4]
问题描述
服务通过LVS提供服务，客户端随机出现连接不上的异常。

正常情况下的抓包

客户端
`telnet service-domain service-port`

> Trying
>  vip...
> Connected to service-domain.
> Escape character is '^]'.

RS
`tcpdump port service-port|grep "client-ip"`

> tcpdump: verbose output suppressed, use -v or -vv for full protocol decode
> listening on eth0, link-type EN10MB (Ethernet), capture size 65535 bytes
> 17:08:10.721223 IP vip.service-port > client-ip.38718: Flags [S.], seq 112836415, ack 3608875463, win 13880, options [mss 1400,sackOK,TS val 2916065122 ecr 3116627304,nop,wscale 7], length 0

LVS

> 17:08:10.753290 IP client-ip.38718 > vip.service-port: Flags [S], seq 3608875462, win 14600, options [mss 1460,sackOK,TS val 3116627304 ecr 0,nop,wscale 7], length 0
> 17:08:10.753554 IP client-ip.38718 > vip.service-port: Flags [.], ack 112836416, win 115, options [nop,nop,TS val 3116627304 ecr 2916065122], length 0

异常情况下的抓包
客户端
`telnet service-domain service-port`

> Trying vip...
> telnet: Unable to connect to remote host: Connection timed out

RS
> NONE

LVS

> 16:59:51.114431 IP client-ip.37895 > vip.service-port: Flags [S], seq 3250454503, win 14600, options [mss 1460,sackOK,TS val 3116502397 ecr 0,nop,wscale 7], length 0
> 16:59:52.114383 IP client-ip.37895 > vip.service-port: Flags [S], seq 3250454503, win 14600, options [mss 1460,sackOK,TS val 3116502647 ecr 0,nop,wscale 7], length 0
> 16:59:54.118427 IP client-ip.37895 > vip.service-port: Flags [S], seq 3250454503, win 14600, options [mss 1460,sackOK,TS val 3116503148 ecr 0,nop,wscale 7], length 0
> 16:59:58.126515 IP client-ip.37895 > vip.service-port: Flags [S], seq 3250454503, win 14600, options [mss 1460,sackOK,TS val 3116504150 ecr 0,nop,wscale 7], length 0

vip配置

> real_server rs-1 service-port {
> 	weight 10
> 	TCP_CHECK {
> 		connect_port service-port
> 		connect_timeout 8
> 		nb_get_retry 3
> 		delay_before_retry 3
> 	}
> }
> 
> real_server rs-2 service-port {
> 	weight 10
> 	TCP_CHECK {
> 		connect_port service-port
> 		connect_timeout 8
> 		nb_get_retry 3
> 		delay_before_retry 3
> 	}
> }

iptables规则
RS-1

> DROP       tcp  --  0.0.0.0/0            0.0.0.0/0            multiport dports service-port

RS-2

> NONE

定位到问题是，RS-1和RS-2未添加ACCEPT指定客户端IP的过滤规则，RS-2未添加DROP指定端口的过滤规则。添加ACCEPT规则后正常。
